show_id,type,title,director,cast,country,date_added,release_year,rating,duration,listed_in,description
s314,Movie,Isle of Dogs,Wes Anderson,"Bryan Cranston, Koyu Rankin, Edward Norton, Bob Balaban, Jeff Goldblum, Bill Murray","United States, Germany, United Kingdom",15-Jan-21,2018,PG-13,102 min,"Action-Adventure, Animation, Comedy","Set in Japan, ISLE OF DOGS follows a boy's odyssey in search of his dog."
s315,Movie,Mary Poppins Returns,Rob Marshall,"Emily Blunt, Lin-Manuel Miranda, Ben Whishaw, Emily Mortimer, Julie Walters, Pixie Davies","United States, United Kingdom",15-Jan-21,2018,PG,140 min,"Family, Fantasy, Musical",Mary Poppins is back to help the Banks family in this reimagined classic.
s316,TV Show,WandaVision,,"Elizabeth Olsen, Paul Bettany, Teyonah Parris, Kathryn Hahn, Randall Park, Kat Dennings",United States,15-Jan-21,2021,TV-14,1 Season,"Drama, Fantasy, Mystery",Two super-powered beings living idealized suburban lives suspect that everything is not as it seems.
s317,TV Show,Disney Fam Jam,,"Phil Wright, Ariel Martin, Trevor Tordjman",United States,8-Jan-21,2020,TV-G,1 Season,"Family, Game Show / Competition, Reality",Families across America compete in epic dance battles!
s318,Movie,Ferdinand,Carlos Saldanha,"Jack Gore, Jet Jurgensmeyer, Nile Diaz, Colin H. Murphy, Carlos Saldanha, Jeremy Sisto","United States, Spain",8-Jan-21,2017,PG,111 min,"Action-Adventure, Animation, Comedy","Ferdinand, a peace-loving bull, rallies a misfit team of friends on the ultimate adventure home."
s319,TV Show,Marvel Studios LEGENDS,,,United States,8-Jan-21,2021,TV-14,1 Season,"Action-Adventure, Docuseries, Fantasy",Marvel Studios LEGENDS celebrates the heroes and villains of the highly anticipated Disney+ shows.
s320,Movie,Toy Story: That Time Forgot,Steve Purcell,"Tom Hanks, Tim Allen, Kristen Schaal, Kevin McKidd, Emily Hahn, Wallace Shawn",United States,8-Jan-21,2014,TV-G,22 min,"Action-Adventure, Animation, Comedy",The Toy Story crew meet a delusional set of action figures.
s321,Movie,700 Sharks,Luc Marescot,Paul Bandey,France,1-Jan-21,2018,TV-PG,45 min,"Animals & Nature, Documentary",Follow an international team of scientists in Polynesia as they study a school of 700 sharks.
s322,Movie,Big Sharks Rule,,Lance Lewman,,1-Jan-21,2018,TV-14,45 min,"Animals & Nature, Documentary","In the waters of South Africa, sharks reign supreme."
s323,Movie,Dr. Seuss' Horton Hears a Who!,"Jimmy Hayward, Steve Martino","Jim Carrey, Steve Carell, Will Arnett, Seth Rogen, Isla Fisher, Amy Poehler",United States,1-Jan-21,2008,G,88 min,"Animation, Comedy, Family",Horton must save a civilization living on a speck of dust from those who don't believe they exist.
s324,Movie,Great Shark Chow Down,Mark Woodward,Dan Nachtrab,,1-Jan-21,2019,TV-PG,45 min,"Animals & Nature, Documentary",Great Shark Chow Down – prepare for a feast of extraordinary shark-feeding events.
s325,Movie,Mega Hammerhead,"Brandon Hill, Marc Ostrick",Neil Hammerschlag,United States,1-Jan-21,2016,TV-PG,43 min,"Animals & Nature, Documentary",Dr. Neil Hammerschlag and his team are setting off on a quest to learn more the Great Hammerhead.
s326,Movie,Burrow,Madeline Sharafian,,United States,25-Dec-20,2020,G,6 min,"Animation, Family",A rabbit attempts to dig a burrow and learns there’s no shame in asking for help.
s327,TV Show,Cosmos: Possible Worlds,,Neil deGrasse Tyson,United States,25-Dec-20,2020,TV-14,1 Season,"Action-Adventure, Docuseries, Family",COSMOS: POSSIBLE WORLDS continues Carl Sagan’s legacy that began more than 40 years ago.
s328,TV Show,Disney Gallery / Star Wars: The Mandalorian,,"Jon Favreau, Dave Filoni, Pedro Pascal, Bryce Howard, Taika Waititi, Carl Weathers",United States,25-Dec-20,2020,TV-PG,2 Seasons,"Action-Adventure, Docuseries, Family",DISNEY GALLERY / STAR WARS: THE MANDALORIAN is a docuseries about the making of The Mandalorian.
s329,Movie,Max Keeble's Big Move,Tim Hill,"Alex D. Linz, Larry Miller, Jamie Kennedy, Zena Grey, Josh Peck, Nora Dunn",United States,25-Dec-20,2001,PG,88 min,"Comedy, Family","After a week of creating mayhem, Max has to face the consequences."
s330,Movie,Soul,Pete Docter,"Jamie Foxx, Tina Fey, Angela Bassett, Ahmir-Khalib ""Questlove"" Thompson, Phylicia Rashad, Daveed Diggs",United States,25-Dec-20,2020,PG,107 min,"Animation, Comedy, Family","Jamie Foxx stars in Pixar’s ""Soul,"" a comedy about what makes you... YOU."
s331,Movie,Arendelle Castle Yule Log,,,United States,18-Dec-20,2020,TV-G,180 min,"Animation, Family",Set the wintry mood for your holiday celebration with Anna and Elsa’s Arendelle Castle yule log.
s332,Movie,Buried Truth of the Maya,,Josh Bernstein,United States,18-Dec-20,2020,TV-PG,48 min,"Documentary, Historical",A high-tech archaeological team explores the hidden secrets of Chichen Itza.
s333,TV Show,Disney Parks Sunrise Series,,,,18-Dec-20,2021,TV-G,1 Season,"Animals & Nature, Docuseries, Family","An inspiring view of Disney Parks few have experienced before, at sunrise. Previously Recorded."
s334,Movie,Dory's Reef Cam,Michal Makarewicz,,United States,18-Dec-20,2020,TV-G,182 min,"Animation, Family",Dive into the waters below and watch the aquatic wildlife from the world of Nemo and Dory.
s335,Movie,Into the Woods,Rob Marshall,"Meryl Streep, Emily Blunt, James Corden, Anna Kendrick, Chris Pine, Tracey Ullman",United States,18-Dec-20,2014,PG,126 min,"Action-Adventure, Fantasy, Musical",A baker and his wife's desperation to have a child sends them on a quest to reverse a witch’s curse.
s336,Movie,"Miraculous World: New York, United Heroez",Thomas Astruc,"Cristina Vee, Bryce Papenbrook, Keith Silverstein, Carrie Keranen, Selah Victor, Sabrina Weisz","United Kingdom, United States, France",18-Dec-20,2020,TV-Y7-FV,60 min,"Action-Adventure, Animation, Fantasy",Marinette’s class is headed to New York!
s337,TV Show,On Pointe,,,United States,18-Dec-20,2020,TV-PG,1 Season,"Docuseries, Family",On Pointe follows students during a season in the School of American Ballet (SAB) in New York City.
s338,TV Show,Wild Nordic,,Dan Nachtrab,,18-Dec-20,2019,TV-PG,1 Season,"Animals & Nature, Docuseries, Reality","As seen by the Viking gods, the fabled wildernesses of Norway, Finland and Sweden are revealed."
s339,Movie,Disney Channel's Epic Holiday Showdown,,,United States,11-Dec-20,2020,TV-G,50 min,"Fantasy, Variety",DC stars try to save the holidays from Scrooge.
s340,Movie,Disney Holiday Magic Quest,,,United States,11-Dec-20,2020,TV-G,46 min,Movies,ZOMBIES stars race to save the holiday magic!
s341,Movie,Gender Revolution: A Journey With Katie Couric,,Katie Couric,United States,11-Dec-20,2017,TV-14,93 min,Documentary,Katie Couric explores questions about gender identity with experts and everyday people.
s342,Movie,High School Musical: The Musical: The Holiday Special,,"Olivia Rodrigo, Joshua Bassett, Sofia Wylie, Matt Cornett, Larry Saperstein, Julia Lester",United States,11-Dec-20,2020,TV-G,46 min,"Drama, Music, Romance",The cast of High School Musical: The Musical: The Series celebrates the holidays with music & more!
s343,Movie,Ralph Breaks the Internet,"Rich Moore, Phil Johnston","John C. Reilly, Sarah Silverman, Gal Gadot, Jane Lynch, Jack McBrayer, Alan Tudyk",United States,11-Dec-20,2018,PG,116 min,"Action-Adventure, Animation, Comedy",Ralph and Vanellope are swept into the internet.
s344,Movie,Safety,Reginald Hudlin,"Jay Reeves, Thaddeus J. Mixson, Corinne Foxx, Matthew Glave, James Badge Dale, Hunter Sansone",United States,11-Dec-20,2020,PG,123 min,"Biographical, Drama, Sports",A drama inspired by the empowering story of former Clemson University safety Ray McElrathbey.
s345,Movie,Anastasia,"Don Bluth, Gary Goldman","Meg Ryan, John Cusack, Kelsey Grammer, Christopher Lloyd, Hank Azaria, Bernadette Peters",United States,4-Dec-20,1997,G,95 min,"Animation, Family, Fantasy","A girl heads to Paris to learn if she is the long lost princess, Anastasia."
s346,Movie,Godmothered,Sharon Maguire,"June Squibb, Jillian Bell, Jane Curtin, Carlease Burke, Sonia Manzano, Erica Parks",United States,4-Dec-20,2020,PG,113 min,"Comedy, Family, Fantasy",An inexperienced fairy godmother-in-training tries to prove that people still need fairy godmothers.
s347,Movie,Man vs. Shark,,"Jeremiah Sullivan, Dave Hoffman",United States,4-Dec-20,2019,TV-PG,45 min,"Animals & Nature, Documentary",Marine biologist attempts to get bitten by a deadly tiger shark and survive
s348,Movie,Mulan,Niki Caro,"Yifei Liu, Donnie Yen, Gong Li, Jet Li, Jason Lee, Yoson An","United States, Canada, Hong Kong",4-Dec-20,2020,PG-13,117 min,"Action-Adventure, Coming of Age, Drama",A young woman risks it all to be a great Chinese warrior in Disney’s MULAN.
s349,Movie,Sky High,Mike Mitchell,"Kelly Preston, Lynda Carter, Michael Angarano, Danielle Panabaker, Mary Elizabeth Winstead, Bruce Campbell",United States,4-Dec-20,2005,PG,101 min,"Action-Adventure, Comedy, Family",It takes inner and outer strength to make a name for yourself when you're the son of heroes.
s350,Movie,The Disney Holiday Singalong,,"Ryan Seacrest, Andrea Bocelli, BTS , Michael Bublé, Ciara , Chloe x Halle",United States,4-Dec-20,2020,TV-G,45 min,"Family, Music, Variety",A festive musical event with more Disney melodies and classic holiday songs.
s351,Movie,The Nutcracker and the Four Realms,"Lasse Hallström, Joe Johnston","Keira Knightley, Mackenzie Foy, Eugenio Derbez, Jayden Fowora-Knight, Matthew Macfadyen, Richard Grant",United States,4-Dec-20,2018,PG,101 min,"Action-Adventure, Family, Fantasy",From Disney comes the reimagined tale of The Nutcracker.
s352,Movie,"Alexander and the Terrible, Horrible, No Good, Very Bad Day",Miguel Arteta,"Steve Carell, Jennifer Garner, Ed Oxenbould, Dylan Minnette, Kerris Dorsey, Jennifer Coolidge",United States,27-Nov-20,2014,PG,83 min,"Comedy, Coming of Age, Family",It's one calamity after another during the worst day of Alexander's life.
s353,Movie,Black Beauty,Ashley Avis,"Mackenzie Foy, Kate Winslet, Iain Glen, Calam Lynch, Claire Forlani, Fern Deacon",United States,27-Nov-20,2020,TV-PG,111 min,"Animals & Nature, Coming of Age, Drama",A wild horse and a teenage girl forge an unbreakable bond which keeps them connected for a lifetime.
s354,Movie,From Our Family to Yours,Angela Affinita,,United Kingdom,27-Nov-20,2020,TV-G,3 min,"Animation, Family","A granddaughter brings joy on Christmas by mending a beloved Mickey, evoking memories of the past."
s355,TV Show,Once Upon a Time in Wonderland,,"Sophie Lowe, Michael Socha, Peter Gadiot, Emma Rigby, Naveen Andrews, John Lithgow","Canada, United States",27-Nov-20,2013,TV-PG,1 Season,"Action-Adventure, Fantasy, Soap Opera / Melodrama",Alice tells a tale of a strange new land.
s356,TV Show,Party Animals,,,,27-Nov-20,2016,TV-G,1 Season,"Animals & Nature, Kids, Music",This music video series captures the funny moments animals have in their day-to-day lives.
s357,Movie,Folklore: the long pond studio sessions,,"Taylor Swift, Aaron Dessner, Jack Antonoff, Justin Vernon",United States,25-Nov-20,2020,TV-14,107 min,"Documentary, Music",An intimate musical concert featuring Taylor Swift performing every song from “folklore.”
s358,TV Show,Bia,,"Isabela Souza, Giulia Guerrini, Julio Peña, Guido Messina, Andrea de Alba, Agustina Palma",Argentina,20-Nov-20,2019,TV-G,1 Season,"Coming of Age, Drama, Music","Bia is filled with passion, after the loss of her sister she will rediscover music and find love."
s359,TV Show,Marvel's 616,,,United States,20-Nov-20,2020,TV-14,1 Season,"Anthology, Docuseries",An anthology documentary series exploring the impact of the Marvel Comics Universe.
s360,Movie,Planes,Klay Hall,"Dane Cook, Stacy Keach, Brad Garrett, Teri Hatcher, Julia Louis-Dreyfus, Priyanka Chopra",United States,20-Nov-20,2013,PG,94 min,"Action-Adventure, Animation, Comedy",A crop duster takes on the world’s fastest in the greatest air race ever.
s361,Movie,Planes: Fire & Rescue,Bobs Gannaway,"Dane Cook, Ed Harris, Julie Bowen, Curtis Armstrong, John Higgins, Hal Holbrook",United States,20-Nov-20,2014,PG,85 min,"Action-Adventure, Animation, Comedy",Air racer Dusty teams up with a dynamic crew of flying firefighters.
s362,Movie,The Real Right Stuff,,,United States,20-Nov-20,2020,TV-PG,90 min,"Documentary, Historical",The Real Right Stuff tells the story of the nation’s first astronauts.
s363,TV Show,The Wonderful World of Mickey Mouse,,"Chris Diamantopoulos, Kaitlyn Robrock, Bill Farmer, Tony Anselmo, Tress MacNeille",United States,18-Nov-20,2020,TV-G,1 Season,"Action-Adventure, Animation, Anthology",It's nothing but fun for Mickey and friends as they embark on their greatest adventures yet.
s364,Movie,LEGO Star Wars Holiday Special,Ken Cunningham,"Helen Sadler, Omar Miller, Jake Green, Kelly Marie Tran, Trevor Devall, Matt Sloan",United States,17-Nov-20,2020,TV-Y7-FV,48 min,"Action-Adventure, Animation, Comedy","On the festive Life Day, Rey and BB-8 embark on an epic adventure across Star Wars history."
s365,Movie,Home Alone,Chris Columbus,"Macaulay Culkin, Joe Pesci, Daniel Stern, John Heard, Roberts Blossom, Catherine O'Hara",United States,13-Nov-20,1990,PG,103 min,"Comedy, Family","When Kevin is home while his family goes on a Christmas trip, he must defend his home from burglars."
s366,Movie,Home Alone 2: Lost in New York,Chris Columbus,"Macaulay Culkin, Joe Pesci, Daniel Stern, John Heard, Devin Ratray, Catherine O'Hara",United States,13-Nov-20,1992,PG,121 min,"Comedy, Family",Kevin is home alone in NYC but won't be for long since the Wet Bandits are also in the Big Apple.
s367,Movie,Home Alone 3,Raja Gosnell,"Alex D. Linz, Haviland Morris, Olek Krupa",United States,13-Nov-20,1997,PG,103 min,"Comedy, Family","A gang of criminals come up against 8 year-old Alex Pruitt, who is home alone with the chicken pox."
s368,TV Show,Inside Pixar,,,United States,13-Nov-20,2020,TV-PG,1 Season,"Docuseries, Family","An inside look at the people, artistry, and culture of Pixar Animation Studios."
s369,Movie,Petra: Secrets of the Ancient Builders,"Thierry Fessard, Yohann Thiriet",Bert Morris,United Arab Emirates,13-Nov-20,2019,TV-G,45 min,"Documentary, Historical","Discover the technical prowess behind Petra, a wonder in the middle of the desert."
s370,Movie,Ultimate Viking Sword,Peter Yost,Jay Sanders,,13-Nov-20,2019,TV-PG,45 min,"Documentary, Historical","National Geographic reconstructs the Ulfberht, a Viking warrior’s ultimate weapon."
s371,Movie,Disney's A Christmas Carol,Robert Zemeckis,"Jim Carrey, Gary Oldman, Colin Firth, Bob Hoskins, Robin Penn, Cary Elwes",United States,6-Nov-20,2009,PG,97 min,"Animation, Fantasy",Three ghosts take Ebenezer Scrooge on an eye-opening journey.
s372,TV Show,Fancy Nancy (Shorts),,"Mia Sinclair Jenness, Dana Heath, Spencer Moss, Alyson Hannigan",,6-Nov-20,2019,TV-Y,1 Season,"Animation, Kids",Follow Nancy as she shows you how to be more Fancy!
s373,TV Show,Goldie & Bear,,"Georgie Kidder, Justine Huxley, Natalie Lander, Jim Cummings, David Kaufman, David Lodge",United States,6-Nov-20,2015,TV-Y,2 Seasons,"Action-Adventure, Animation, Buddy",Goldie and Bear go on adventures in Fairytale Forest.
s374,Movie,Mr. Magoo,Stanley Tong,"Leslie Nielsen, Kelly Lynch, Ernie Hudson, Stephen Tobolowsky, Nick Chinlund, Matt Keeslar",United States,6-Nov-20,1997,PG,88 min,"Action-Adventure, Comedy, Crime",Clueless Mr. Magoo sets out to get back a stolen precious gem.
s375,Movie,Prep & Landing,"Kevin Deters, Stevie Wermers-Skelton","Dave Foley, Sarah Chalke, Mason Cotton, Lino DiSalvo, Derek Richardson, William Sheppard",United States,6-Nov-20,2009,TV-G,23 min,"Animation, Family, Fantasy",An elite elf unit ensures homes around the world are prepared for Santa.
s376,Movie,Prep & Landing: Naughty vs. Nice,"Kevin Deters, Stevie Wermers-Skelton","Dave Foley, Derek Richardson, Sarah Chalke, Rob Riggle, Chris Parnell, W. Sheppard",United States,6-Nov-20,2011,TV-G,23 min,"Animation, Family, Fantasy",Wayne and Lanny race to save Christmas!
s377,Movie,Disney Channel Halloween House Party,Trevor Moore,"Tobie Windham, Raphael Alejandro, Suzi Barrett, Isaac Ryan Brown, Kylie Cantrall, Scarlett Estevez",United States,30-Oct-20,2020,TV-G,23 min,"Comedy, Variety","Disney Channel Stars celebrate Halloween in a sketch comedy special with tricks, treats, and more!"
s378,TV Show,The Mandalorian,,"Pedro Pascal, Carl Weathers, Gina Carano, Omid Abtahi, Nick Nolte",United States,30-Oct-20,2019,TV-14,2 Seasons,"Action-Adventure, Family, Science Fiction","After the fall of the Empire, a lone gunfighter makes his way through the lawless galaxy."
s379,Movie,The Sorcerer's Apprentice,Jon Turteltaub,"Nicolas Cage, Jay Baruchel, Alfred Molina, Teresa Palmer, Monica Bellucci, Omar Miller",United States,30-Oct-20,2010,PG,111 min,"Action-Adventure, Fantasy",A modern-day sorcerer must make his seemingly average recruit into the ultimate apprentice.
s380,TV Show,X-Ray Earth,,,United States,30-Oct-20,2020,TV-PG,1 Season,"Animals & Nature, Docuseries, Reality",What if we could x-ray the Earth to reveal the origins of natural disasters? Now we can.
s381,TV Show,Gathering Storm,,Tucker McDougall,United States,23-Oct-20,2020,TV-PG,1 Season,"Animals & Nature, Docuseries","Witness first hand stories combined with scientific insight, analysis and satellite mapping."
s382,TV Show,India From Above,,Dev Patel,,23-Oct-20,2019,TV-PG,1 Season,"Docuseries, Reality","India From Above, a two-part aerial documentary of a nation and its people."
s383,TV Show,Marvel Super Hero Adventures,,,United States,23-Oct-20,2017,TV-Y,4 Seasons,"Action-Adventure, Animation, Kids",Spider-Man sets off on adventures with Marvel heroes!
s384,Movie,Once Upon a Snowman,"Dan Abraham, Trent Correy","Josh Gad, Idina Menzel, Kristen Bell, Jonathan Groff, Chris Williams",United States,23-Oct-20,2020,TV-PG,12 min,"Animation, Comedy, Coming of Age",This new short film follows Olaf’s first steps as he comes to life and searches for his identity.
s385,Movie,Pompeii: Secrets Of The Dead,Ben Finney,Maite Jauregui,United States,23-Oct-20,2019,TV-PG,45 min,"Documentary, Historical",Forensic experts scan Pompeii’s victims to investigate why they didn’t escape the eruption.
s386,Movie,Toy Story of Terror!,Angus MacLane,"Tom Hanks, Tim Allen, Joan Cusack, Carl Weathers, Stephen Tobolowsky, Timothy Dalton",United States,23-Oct-20,2013,TV-G,22 min,"Animation, Comedy, Family",Join the Toy Story gang in a frighteningly fun animated adventure.
s387,Movie,Beverly Hills Chihuahua,Raja Gosnell,"Piper Perabo, Manolo Cardona, Jamie Curtis, Jose Yazpik, Maury Sterling, Jesus Ochoa","United States, Mexico",16-Oct-20,2008,PG,95 min,"Action-Adventure, Comedy, Family","Papi has to rescue his true love, Chloe, when she gets lost in Mexico."
s388,Movie,Clouds,Justin Baldoni,"Fin Argus, Sabrina Carpenter, Madison Iseman, Neve Campbell, Tom Scott, Lil Rel Howery",United States,16-Oct-20,2020,PG-13,122 min,"Biographical, Drama, Music",A young musician with months to live turns to music to make the most of the time he has left.
s389,Movie,Lost on Everest,Renan Ozturk,Tate Donovan,United States,16-Oct-20,2020,TV-14,60 min,"Animals & Nature, Documentary, Survival",The quest to reveal what happened to the explorers who first set out to summit Mt. Everest.
s390,Movie,Marvel's Iron Man & Captain America: Heroes United,Leo Riley,"Adrian Pasdar, Roger Smith, Fred Tatasciore, David Kaye, Liam O'Brien, Clancy Brown",United States,16-Oct-20,2014,PG,72 min,"Action-Adventure, Animation, Science Fiction",Iron Man and Captain America battle the Red Skull and Taskmaster.
s391,TV Show,Meet The Chimps,,Jane Lynch,United States,16-Oct-20,2020,TV-PG,1 Season,"Animals & Nature, Docuseries, Family","Meet the Chimps takes viewers inside the secret life of Chimp Haven, a unique wildlife sanctuary."
s392,TV Show,The Rocketeer,,"Kitana Turnbull, Billy Campbell, Kathy Najimy, Callan Farris, Frank Welker",United States,16-Oct-20,2019,TV-Y,1 Season,"Action-Adventure, Animation, Kids",Kit becomes a rocket-pack wearing superhero!
s393,Movie,Oil Spill of The Century,,Loïck Peyron,,9-Oct-20,2019,TV-PG,45 min,"Documentary, Historical",Loïck Peyron investigates the 1978 Amoco Cadiz oil spill and its impact.
s394,Movie,The Chronicles Of Narnia: The Voyage of the Dawn Treader,Michael Apted,"Georgie Henley, Skandar Keynes, Ben Barnes, Will Poulter, Tilda Swinton","United States, United Kingdom",9-Oct-20,2010,PG,113 min,"Action-Adventure, Family, Fantasy",Three heroes sail with King Caspian to help Narnian lords banished by an evil usurper of the throne.
s395,TV Show,The Right Stuff,,"Jake McDorman, Patrick Adams, Colin O’Donoghue, Eloise Mumford, James Lafferty, Nora Zehetner",United States,9-Oct-20,2020,TV-14,1 Season,"Drama, Historical",The incredible story of the Mercury Seven astronauts and their extraordinary achievements.
s396,Movie,Wild Portugal,Christian Baumeister,Bart Thomasson,,9-Oct-20,2020,TV-14,45 min,"Animals & Nature, Documentary, Family",Explore a rugged world where diverse species fight for survival.
s397,Movie,X2,Bryan Singer,"Patrick Stewart, Hugh Jackman, Ian McKellen, Halle Berry, Famke Janssen, James Marsden","Canada, United States",9-Oct-20,2003,PG-13,134 min,"Action-Adventure, Family, Science Fiction","X-Men newcomer, Night Crawler, joins Magneto to rescue their brethren and forestall a holocaust."
s398,Movie,Mr. Holland's Opus,Stephen Herek,"Richard Dreyfuss, Glenne Headly, Jay Thomas, W.H. Macy, Alicia Witt, Jean Kelly",United States,2-Oct-20,1996,PG,143 min,"Drama, Music",A musician finds his passion when he takes a “day job” as a music teacher.
s399,Movie,Disneynature Oceans,"Jacques Perrin, Jacques Cluzaud","Pierce Brosnan, Lancelot Perrin","France, Switzerland, Spain, United States, United Arab Emirates",25-Sep-20,2010,G,84 min,"Animals & Nature, Documentary, Family",Journey into the depths of a wonderland filled with beauty and power.
s400,Movie,Hidden Figures,Theodore Melfi,"Taraji Henson, Octavia Spencer, Janelle Monáe, Kevin Costner, Kirsten Dunst, Jim Parsons",United States,25-Sep-20,2016,PG,128 min,"Biographical, Drama, Family",A story about three women at NASA who helped launch John Glenn into orbit.
s401,TV Show,Magic of Disney's Animal Kingdom,,Josh Gad,United Kingdom,25-Sep-20,2020,TV-PG,1 Season,"Animals & Nature, Docuseries, Family",Magic of Disney’s Animal Kingdom goes backstage at Walt Disney World Resort. Narrated by Josh Gad.
s402,Movie,Secret Society of Second-Born Royals,,"Peyton Lee, Niles Fitch, Isabella Blake-Thomas, Olivia Deeble, Skylar Astin, Elodie Yung",United States,25-Sep-20,2020,TV-PG,99 min,"Action-Adventure, Coming of Age, Family","Sam, a rebellious royal, learns she is part of the Secret Society of Second-Born Royals."
s403,Movie,The Giant Robber Crab,Moritz Katz,Colin Solman,United States,25-Sep-20,2019,TV-PG,44 min,"Animals & Nature, Documentary","As we follow the robber’s life cycle, we learn that crabs are much more than creepy crawlies."
s404,TV Show,Wild Central America,,Nigel Marven,,25-Sep-20,2020,TV-PG,1 Season,"Action-Adventure, Animals & Nature, Docuseries",Presenter Nigel Marven discovers the colourful and varied wildlife and culture of Central America.
s405,TV Show,Ancient China from Above,,Dr. Allan Maca,United States,18-Sep-20,2020,TV-14,1 Season,"Docuseries, Historical",Archaeologist Allan Maca reveals the amazing wonders of Ancient China like never before.
s406,TV Show,Becoming,,,United States,18-Sep-20,2020,TV-PG,1 Season,"Anthology, Docuseries, Family","Becoming chronicles the origin stories of world-class entertainers, musicians and athletes."
s407,TV Show,Coop & Cami Ask The World,,"Ruby Turner, Dakota Lotus, Olivia Sanabia, Albert Tsai, Paxton Booth, Rebecca Metz",United States,18-Sep-20,2018,TV-G,2 Seasons,"Comedy, Family, Kids","Cooper and Cami Wrather co-host ""Would You Wrather."""
s408,TV Show,Europe from Above,,Julian Barratt,United Kingdom,18-Sep-20,2019,TV-G,1 Season,"Docuseries, Reality",Europe from Above takes to the air over Europe’s finest cultural and geographical landmarks.
s409,Movie,Ever After: A Cinderella Story,Andy Tennant,"Drew Barrymore, Anjelica Huston, Dougray Scott, Patrick Godfrey, Megan Dodds, Melanie Lynskey",United States,18-Sep-20,1998,PG-13,122 min,"Drama, Romance",A young woman falls in love with a prince while pretending to be a princess.
s410,TV Show,Kingdom of the Mummies,,Kerry Shale,United States,18-Sep-20,2020,TV-14,1 Season,"Docuseries, Historical, Reality",A team of archaeologists uncover the first Egyptian funeral parlor ever found.
s411,Movie,Morning Light,Mark Monroe,Patrick Warburton,United States,18-Sep-20,2008,PG,99 min,"Documentary, Sports","Fifteen rookie sailors race to be part of the ""Morning Light"" crew."
s412,Movie,Notre Dame: Race Against The Inferno,"Fabrice Gardel, Simon Kessler, Josselin Mahot",Paul Bandey,"United Kingdom, France",18-Sep-20,2019,TV-PG,45 min,Documentary,"On April 15, 2019, Paris’ firefighters gave everything to save the Notre Dame cathedral."
s413,TV Show,Once Upon a Time,,"Ginnifer Goodwin, Jennifer Morrison, Robert Carlyle, Lana Parrilla, Jared Gilmore, Josh Dallas",United States,18-Sep-20,2011,TV-PG,7 Seasons,"Action-Adventure, Fantasy, Soap Opera / Melodrama",Fairy tale characters inhabit a land of good and evil.
s414,TV Show,Soy Luna,,"Karol Sevilla, Ruggero Pasquarelli, Valentina Zenere, Lucila Gandolfo, Michael Ronda, Carolina Kopelioff","Argentina, Mexico",18-Sep-20,2015,TV-G,3 Seasons,"Comedy, Coming of Age, Drama",Luna will learn that love transcends distance.
s415,TV Show,Violetta,,"Diego Ramos, Martina Stoessel, Pablo Espinosa, Jorge Blanco, Mercedes Lambre, Nicolás Garnier",Argentina,18-Sep-20,2011,TV-G,3 Seasons,"Coming of Age, Drama, Music",Violetta is a talented teen following her dream.
