show_id,type,title,director,cast,country,date_added,release_year,rating,duration,listed_in,description
s416,Movie,Christopher Robin,Marc Forster,"Ewan McGregor, Hayley Atwell, Bronte Carmichael, Mark Gatiss, Oliver Davies, Ronke Adekoluejo","United Kingdom, United States",11-Sep-20,2018,PG,109 min,"Drama, Family, Fantasy",Pooh leaves the Hundred Acre Wood to help grown-up Christopher Robin.
s417,Movie,D2: The Mighty Ducks,Sam Weisman,"Emilio Estevez, Michael Tucker, Jan Rubeš, Kathryn Erbe, Joshua Jackson, Elden Ratliff",United States,4-Sep-20,1994,PG,107 min,"Comedy, Drama, Family",The Mighty Ducks face the meanest team on ice at the Junior Goodwill Games.
s418,Movie,D3: The Mighty Ducks,Robert Lieberman,"Emilio Estevez, Jeffrey Nordling, David Selby, Heidi Kling, Joshua Jackson, Elden Ratliff",United States,4-Sep-20,1996,PG,104 min,"Comedy, Coming of Age, Drama",The Mighty Ducks inherit a new coach and a new set of problems.
s419,TV Show,Earth to Ned,,,United States,4-Sep-20,2020,TV-PG,1 Season,"Comedy, Parody, Science Fiction","From the Jim Henson Company, alien commander Ned hosts a late-night talk show with celebrity guests."
s420,Movie,Trick or Treat,Jack Hannah,,United States,4-Sep-20,1952,TV-G,9 min,"Animation, Family, Fantasy","Donald plays a trick on his nephews, but a witch helps them out. See details for advisory."
s421,Movie,Alice Through the Looking Glass,James Bobin,"Johnny Depp, Anne Hathaway, Mia Wasikowska, Matt Lucas, Rhys Ifans, Helena Carter","United States, United Kingdom",28-Aug-20,2016,PG,115 min,"Action-Adventure, Fantasy",Alice returns to Underland to save the Mad Hatter in a race against time.
s422,Movie,Phineas and Ferb The Movie: Candace Against the Universe,,"Ashley Tisdale, Vincent Martella, Ali Wong, Dan Povenmire, Alyson Stoner, Maulik Pancholy",United States,28-Aug-20,2020,TV-G,86 min,"Action-Adventure, Animation, Comedy","Phineas and Ferb set out across the galaxy to rescue Candace, who has been abducted by aliens."
s423,Movie,Back to the Titanic,,,United Kingdom,21-Aug-20,2020,TV-PG,44 min,"Documentary, Historical",Back to the Titanic documents the first manned dives to Titanic in nearly 15 years.
s424,Movie,Beauty and the Beast,Bill Condon,"Emma Watson, Dan Stevens, Luke Evans, Kevin Kline, Josh Gad, Ewan McGregor",United States,21-Aug-20,2017,PG,138 min,"Family, Fantasy, Musical",Belle must look beyond the Beast’s exterior to find the true Prince within.
s425,Movie,Mars: One Day on the Red Planet,Martin Johnson,Nigel Barber,United States,21-Aug-20,2020,TV-PG,88 min,Documentary,"An epic journey around the real Mars – built from data, as you’ve never seen it before."
s426,Movie,The One and Only Ivan,Thea Sharrock,"Sam Rockwell, Angelina Jolie, Danny DeVito, Helen Mirren, Brooklynn Prince, Ramón Rodríguez",United States,21-Aug-20,2020,PG,95 min,"Drama, Family, Fantasy",An adaptation of the award-winning book about a very special gorilla.
s427,TV Show,"Weirdest, Bestest, Truest",,"Charlie Engelman, Kirby Engelman",,21-Aug-20,2018,TV-G,1 Season,"Animals & Nature, Kids, Variety",Siblings Kirby and Charlie share strange discoveries and fun facts from the world of Weird But True!
s428,TV Show,Disney Junior T.O.T.S.: Calling All T.O.T.S. (Shorts),,"Jet Jurgensmeyer, Christian Simon, Megan Hilty",,14-Aug-20,2020,TV-Y,1 Season,"Animation, Kids, Music",What happens after the baby animals are delivered?
s429,Movie,Disney Zombies 2,Paul Hoen,"Milo Manheim, Meg Donnelly, Trevor Tordjman, Kylee Russell, Carla Jeffery, Chandler Kinney",United States,14-Aug-20,2020,TV-G,84 min,"Coming of Age, Fantasy, Musical",Zed and Addison encounter a group of werewolves!
s430,Movie,India's Wild Leopards,,"Sandesh Kadur, Priya Singh",India,14-Aug-20,2020,TV-14,45 min,"Animals & Nature, Documentary",Cameraman Sandesh Kadur’s mission is to uncover the secretive lives of India’s leopards.
s431,TV Show,Jungle Animal Rescue,,Dan Nachtrab,United States,14-Aug-20,2019,TV-PG,1 Season,"Animals & Nature, Docuseries, Family",A team of conservationists and veterinarians helps India’s people and wildlife coexist.
s432,Movie,Magic Camp,Mark Waters,"Adam DeVine, Gillian Jacobs, Nathaniel McIntyre, Jeffrey Tambor, Cole Sand, Isabella Crovetti",United States,14-Aug-20,2020,PG,101 min,"Comedy, Family",A group of misfit campers help a down-on-his-luck magician rediscover his love of magic.
s433,Movie,Marvel Studios' Ant-Man and the Wasp,Peyton Reed,"Paul Rudd, Evangeline Lilly, Michael Peña, Walton Goggins, Hannah John-Kamen, David Dastmalchian",United States,14-Aug-20,2018,PG-13,120 min,"Action-Adventure, Comedy, Science Fiction",Ant-Man and the Wasp must join forces to uncover secrets from the past.
s434,TV Show,Nature Boom Time,,"Charlie Engelman, Kirby Engelman, Patrick Rahill",United States,14-Aug-20,2016,TV-G,1 Season,"Animals & Nature, Docuseries, Kids","Charlie, Kirby, and Patrick travel around the U.S. to learn about what makes nature awesome."
s435,TV Show,Sam's Zookeeper Challenge,,Sam Peltz,United States,14-Aug-20,2018,TV-G,1 Season,"Animals & Nature, Docuseries, Family",Sam is put to the test to care for animals in “Zookeeper’s Challenge.”
s436,TV Show,Scuba Sam's World,,Sam Peltz,United States,14-Aug-20,2018,TV-G,1 Season,"Animals & Nature, Docuseries, Kids",Take a deep dive and learn all about the beloved sea animals in our oceans!
s437,TV Show,Spaced Out,,Ben DeTour,,14-Aug-20,2018,TV-G,1 Season,"Docuseries, Kids",Learn about our universe through imagery taken from the Hubble Space Telescope.
s438,Movie,The Greatest Showman,Michael Gracey,"Hugh Jackman, Zac Efron, Michelle Williams, Rebecca Ferguson, Zendaya , Keala Settle",United States,14-Aug-20,2017,PG,106 min,"Biographical, Drama, Family",A bold and original musical celebrating the birth of show business and dreams coming to life.
s439,TV Show,Weird But True!,,"Charlie Engelman, Kirby Engelman",United States,14-Aug-20,2017,TV-G,3 Seasons,"Animals & Nature, Kids, Variety","Come along as we reveal fun, strange & surprising facts about our world in Weird But True!"
s440,TV Show,Wild Cats of India,,James Murray,United States,14-Aug-20,2020,TV-PG,1 Season,"Animals & Nature, Docuseries, Family",Journey across the country’s landscapes to paint an intimate portrait of India's Wild Cats.
s441,Movie,Howard,Don Hahn,Howard Ashman,United States,7-Aug-20,2020,TV-PG,95 min,"Biographical, Documentary, Music","“Howard” is the untold story of Howard Ashman, the brilliant lyricist behind Disney classics."
s442,Movie,Prince of Persia: The Sands of Time,Mike Newell,"Jake Gyllenhaal, Ben Kingsley, Gemma Arterton, Alfred Molina, Richard Coyle, Toby Kebbell",United States,7-Aug-20,2010,PG-13,117 min,"Action-Adventure, Fantasy",A rogue prince and rival princess safeguard a magical dagger with the power to reverse time.
s443,Movie,Star Wars: Galaxy's Edge-Adventure Awaits,,"Neil Harris, Kaley Cuoco, Oscar Isaac, Sarah Hyland, Keegan-Michael Key, Jay Leno",United States,7-Aug-20,2019,TV-PG,81 min,"Documentary, Family",Celebrating Disney’s new land that brings Star Wars to life!
s444,Movie,The Hidden Kingdoms of China,"Ben Wallis, Emma Fraser, Jess Tombs",Michelle Yeoh,United States,7-Aug-20,2020,TV-PG,88 min,"Animals & Nature, Documentary, Family",THE HIDDEN KINGDOMS OF CHINA takes audiences into the secret wilds of China.
s445,Movie,The Peanuts Movie,Steve Martino,"Noah Schnapp, Alex Garfin, Hadley Miller, Mariel Sheets, Venus Schultheis, Noah Johnston",United States,7-Aug-20,2015,G,89 min,"Animation, Comedy, Family","Snoopy takes to the skies against The Red Baron, while his pal, Charlie Brown, begins an epic quest."
s446,TV Show,UFO Europe: The Untold Stories,,Robert Ashby,,7-Aug-20,2012,TV-PG,1 Season,"Docuseries, Reality",A selection of stories featuring encounters and sightings of the unexplained.
s447,TV Show,Animal Showdown,,Brian Peck,,31-Jul-20,2018,TV-G,1 Season,"Animals & Nature, Docuseries, Family",Animals face-off in this surprising competition of the toughest and biggest in the animal kingdom.
s448,TV Show,Best Job Ever,,,,31-Jul-20,2018,TV-G,1 Season,"Animals & Nature, Docuseries, Family",Check out the cool jobs Nat Geo explorers do every day!
s449,Movie,Big Cat Games,Jeremy Turner,Boone Smith,,31-Jul-20,2015,TV-PG,44 min,"Animals & Nature, Family, Reality","Boone Smith hosts a feline showdown as lion, tiger and cheetah battle for top cat title."
s450,Movie,Black Is King,Beyoncé Knowles-Carter,Beyoncé Knowles-Carter,United States,31-Jul-20,2020,TV-14,86 min,"Dance, Music, Musical","This visual album from Beyoncé reimagines lessons of ""The Lion King"" for young kings and queens."
s451,Movie,Cradle of the Gods,Tim Conrad,Tim Conrad,United Kingdom,31-Jul-20,2012,TV-PG,45 min,"Documentary, Historical","Located on a hilltop sanctuary, G – bekli Tepe in Turkey is the world's first known temple."
s452,TV Show,Destination World,,Rick Robles,,31-Jul-20,2018,TV-G,1 Season,"Animals & Nature, Docuseries, Kids",Check out the continents and find out what makes them unique from each other!
s453,TV Show,Fearless Adventures with Jack Randall,,Jack Randall,,31-Jul-20,2018,TV-PG,1 Season,"Animals & Nature, Docuseries, Family",Check out Jack Randall go head-to-head with all kinds of critters.
s454,Movie,Hunt for the Abominable Snowman,Dan Oliver,Stephen Rashbrook,,31-Jul-20,2011,TV-PG,45 min,Documentary,"Across the Himalayas are stories of the yeti, or abominable snowman."
s455,Movie,Incredibles 2,Brad Bird,"Craig Nelson, Holly Hunter, Sarah Vowell, Huckleberry Milner, Catherine Keener, Eli Fucile",United States,31-Jul-20,2018,PG,118 min,"Action-Adventure, Animation, Family",The Incredibles spring into action when a dangerous new villain emerges.
s456,TV Show,King Fishers,,Stephen Mangan,United Kingdom,31-Jul-20,2013,TV-PG,1 Season,"Action-Adventure, Animals & Nature, Docuseries","With so many fishermen and so many fishing disciplines, who is best?"
s457,Movie,Lost Temple of the Inca,Jim Aikman,Dan Nachtrab,United States,31-Jul-20,2020,TV-PG,44 min,Documentary,A scientist discovers artifacts in Peru that could lead him to one of the country’s missing temples.
s458,TV Show,Marvel Funko Shorts,,,,31-Jul-20,2016,TV-Y7,2 Seasons,"Action-Adventure, Animation, Anthology",Marvel and Funko present Pop! style Marvel heroes.
s459,TV Show,Muppets Now,,"Dave Goelz, Matt Vogel, David Rudman, Peter Linz, Bill Barretta, Eric Jacobson",United States,31-Jul-20,2020,TV-PG,1 Season,"Comedy, Family, Lifestyle",The Muppets have a brand-new series ready to stream… but only if they can upload it in time.
s460,Movie,Surviving the Mount St. Helens Disaster,Sophie Harris,Bill Ratner,United Kingdom,31-Jul-20,2020,TV-PG,44 min,"Animals & Nature, Documentary",Eyewitness accounts and rare images chart the violent 1980 eruption of Mount St. Helens.
s461,TV Show,What Sam Sees,,Sam Peltz,,31-Jul-20,2018,TV-G,1 Season,"Animals & Nature, Docuseries, Family","Join Sam on an underwater journey and learn about sharks, eels, and more!"
s462,Movie,Pirates of the Caribbean: Dead Men Tell No Tales,"Joachim Rønning, Espen Sandberg","Johnny Depp, Javier Bardem, Brenton Thwaites, Kaya Scodelario, Kevin McNally, Golshifteh Farahani",United States,24-Jul-20,2017,PG-13,129 min,"Action-Adventure, Fantasy",Captain Jack Sparrow searches for the Trident of Poseidon.
s463,TV Show,PJ Masks (Shorts),,,,24-Jul-20,2017,TV-Y,1 Season,"Action-Adventure, Animation, Kids",The PJ Masks are protecting the city from villains!
s464,TV Show,Rogue Trip,,"Bob Woodruff, Mack Woodruff",,24-Jul-20,2020,TV-PG,1 Season,"Buddy, Docuseries",Bob Woodruff and his son travel the world searching for beauty and adventure in unexpected places.
s465,TV Show,Wild Congo,,Corey Johnson,,24-Jul-20,2014,TV-PG,1 Season,"Animals & Nature, Docuseries, Family",The Congo: the most mysterious river in the dark heart of Africa.
s466,TV Show,Wild Sri Lanka,,Paul McGann,United Kingdom,24-Jul-20,2016,TV-PG,1 Season,"Animals & Nature, Docuseries",This three-part series reveals the spectacular nature and amazing wildlife of Sri Lanka.
s467,Movie,A Pre-Opening Report from Disneyland,Wilfred Jackson,"Walt Disney, Winston Hibler",United States,17-Jul-20,1955,TV-PG,55 min,"Documentary, Family, Historical",Walt provides a look at the details needed to get the Park ready to open. See details for advisory.
s468,Movie,Diary of a Wimpy Kid: The Long Haul,David Bowers,"Jason Drucker, Alicia Silverstone, Tom Scott, Charlie Wright, Owen Asztalos, Dylan Walters",United States,17-Jul-20,2017,PG,92 min,"Comedy, Family",A trip to Meemaw’s 90th birthday takes a detour due to Greg’s scheme to attend a gaming convention!
s469,TV Show,Disney Junior Music Lullabies,,,,17-Jul-20,2018,TV-Y,1 Season,"Animation, Kids, Music",Disney Junior songs reimagined as calming lullabies.
s470,Movie,Lost City of Machu Picchu,,Craig Sechler,United States,17-Jul-20,2019,TV-14,44 min,"Documentary, Family",Who were the mysterious people who built Machu Picchu and why?
s471,TV Show,Super Robot Monkey Team Hyperforce Go!,,"Greg Cipes, Kevin Michael	Richardson, Tom Kenny, Kari Wahlgren, Clancy Brown, Corey Feldman","United States, Japan",17-Jul-20,2004,TV-Y7,2 Seasons,"Action-Adventure, Animation, Anime",Chiro and a team of five Robot Monkeys defend Shuggazoom City against Skeleton King and his minions.
s472,Movie,The Mouseketeers at Walt Disney World,John Tracy,"Jo Worley, Ronnie Schell, Dennis Underwood, Leslie Norris, Billy Attmore, Scott Craig",United States,17-Jul-20,1977,TV-PG,56 min,"Coming of Age, Drama, Family",The Mouseketeers arrive to perform at Walt Disney World. See details for advisory.
s473,TV Show,Wild Chile,,Peter Venn,United Kingdom,17-Jul-20,2017,TV-PG,1 Season,"Animals & Nature, Docuseries, Family",This beautiful and intriguing blue-chip series explores the incredibly varied wildlife of Chile.
s474,Movie,X-Men: Apocalypse,Bryan Singer,"James McAvoy, Michael Fassbender, Jennifer Lawrence, Oscar Isaac, Nicholas Hoult, Rose Byrne",United States,17-Jul-20,2016,PG-13,144 min,"Action-Adventure, Family, Science Fiction","Apocalypse, the most powerful mutant in the universe, tries to destroy all of mankind."
s475,TV Show,Cosmos: A Spacetime Odyssey,,"Neil Tyson, Stoney Emshwiller",United States,10-Jul-20,2013,TV-PG,1 Season,"Action-Adventure, Docuseries, Family",A 13-part adventure across the universe of space and time.
s476,Movie,Hamilton: History Has Its Eyes on You,,"Lin-Manuel Miranda, Thomas Kail, Christopher Jackson, Leslie Odom Jr., Phillipa Soo, Renee Goldsberry",United States,10-Jul-20,2020,TV-PG,47 min,"Historical, Musical","Robin Roberts hosts a discussion with Lin-Manuel Miranda, Thomas Kail, and original cast members."
s477,Movie,Solo: A Star Wars Story,Ron Howard,"Alden Ehrenreich, Woody Harrelson, Emilia Clarke, Donald Glover, Thandie Newton, Phoebe Waller-Bridge",United States,10-Jul-20,2018,PG-13,135 min,"Action-Adventure, Crime, Science Fiction",Witness the beginning of the Star Wars saga's most unlikely hero.
s478,Movie,X-Men: Days of Future Past,Bryan Singer,"Hugh Jackman, James McAvoy, Michael Fassbender, Jennifer Lawrence, Halle Berry, Nicholas Hoult","United States, United Kingdom, Canada",10-Jul-20,2014,PG-13,132 min,"Action-Adventure, Family, Science Fiction",Characters from the X-Men trilogy join their younger selves to change the past and save our future.
s479,Movie,The Undefeated Presents: Hamilton In-Depth,,"Lin-Manuel Miranda, Thomas Kail, Renee Goldsberry, Leslie Odom Jr., Daveed Diggs, Phillipa Soo",United States,5-Jul-20,2020,TV-PG,33 min,"Historical, Musical",The Undefeated Presents: Hamilton In-Depth is a roundtable discussion with 9 stars and the director.
s480,TV Show,Animal ER,,Dr. Brian Beale,United States,3-Jul-20,2016,TV-PG,2 Seasons,"Animals & Nature, Docuseries, Family",Animal ER brings you up close to the bleeding edge of animal care.
s481,Movie,Diary of a Wimpy Kid: Rodrick Rules,David Bowers,"Zachary Gordon, Devon Bostick, Rachael Harris, Robert Capron, Steve Zahn",United States,3-Jul-20,2011,PG,100 min,"Comedy, Family","In 7th grade, Greg must bond with his brother, Rodrick while also impressing the new girl in town."
s482,Movie,Hamilton,Thomas Kail,"Daveed Diggs, Renée Goldsberry, Jonathan Groff, Christopher Jackson, Jasmine Jones, Lin-Manuel Miranda",United States,3-Jul-20,2020,PG-13,160 min,"Biographical, Historical, Musical",The filmed version of Broadway original “Hamilton” that soars in music and tale.
s483,Movie,Ice Age: Collision Course,Mike Thurmeier,"Ray Romano, John Leguizamo, Denis Leary, Adam Devine, Jesse Ferguson, Max Greenfield","United States, United Kingdom, Australia",3-Jul-20,2016,PG,97 min,"Action-Adventure, Animation, Comedy","When their world is threatened, Manny and friends go on a quest to survive the Scrat-tastrophe!"
s484,Movie,Race to Witch Mountain,Andy Fickman,"Dwayne Johnson, AnnaSophia Robb, Carla Gugino, Ciarán Hinds, Alexander Ludwig, Tom Scott",United States,3-Jul-20,2009,PG,100 min,"Action-Adventure, Family, Science Fiction",A Las Vegas cab driver helps two aliens disguised as teens get home to save their planet... and ours.
s485,Movie,The Big Green,Holly Sloan,"Steve Guttenberg, Olivia d'Abo, Jay Sanders, John Terry, Chauncey Leopardi, Patrick Renna",United States,3-Jul-20,1995,PG,100 min,"Comedy, Family, Sports",A group of bored misfits become local soccer heroes in a sleepy Texas town.
s486,Movie,The Mighty Ducks,Stephen Herek,"Emilio Estevez, Joss Ackland, Lane Smith, Heidi Kling, Josef Sommer, Joshua Jackson",United States,3-Jul-20,1992,PG,104 min,"Comedy, Drama, Sports",A hotshot lawyer reluctantly coaches a hapless pee wee hockey team.
s487,Movie,While You Were Sleeping,Jon Turteltaub,"Sandra Bullock, Bill Pullman, Peter Gallagher, Peter Boyle, Glynis Johns, Micole Mercurio",United States,3-Jul-20,1995,PG,104 min,"Comedy, Drama, Romance",A lonely subway worker is mistaken for a comatose man's finacée.
s488,TV Show,Disney A.N.T. Farm,,"China McClain, Sierra McCormick, Jake Short, Stefanie Scott, Carlon Jeffery",United States,26-Jun-20,2011,TV-G,3 Seasons,"Comedy, Coming of Age, Music",Chyna Sparks and her friends are the newest members of the A.N.T. program.
s489,TV Show,Into the Unknown: Making Frozen 2,,"Kristen Bell, Idina Menzel, Josh Gad, Jonathan Groff, Jennifer Lee, Chris Buck",United States,26-Jun-20,2020,TV-PG,1 Season,"Docuseries, Family","For the first time, go behind-the-scenes into the making of the #1 animated film, Frozen 2."
s490,Movie,Man in Space,Ward Kimball,"Walt Disney, Dick Tufeld, Ward Kimball, Willy Ley, Dr. Heinz Haber, Dr. Wernher von Braun",United States,26-Jun-20,1955,TV-PG,49 min,"Documentary, Family","From the TV series Disneyland, a look at the history of space travel. See details for advisory."
s491,Movie,Mars and Beyond,Ward Kimball,"Walt Disney, Paul Frees, Dr. Ernst Stuhlinger, Dr. Wernher von Braun, Dr. E.C. Slipher",United States,26-Jun-20,1957,TV-G,53 min,"Animation, Documentary, Family",An animated look at humankind's early views of the universe and life on Mars.
s492,Movie,Marvel Studios' Avengers: Infinity War,"Anthony Russo, Joe Russo","Robert Downey Jr., Chris Hemsworth, Mark Ruffalo, Chris Evans, Scarlett Johansson, Don Cheadle",United States,26-Jun-20,2018,PG-13,152 min,"Action-Adventure, Fantasy, Science Fiction",The Avengers must be willing to sacrifice all to defeat Thanos.
s493,Movie,Tarzan,"Kevin Lima, Chris Buck","Tony Goldwyn, Minnie Driver, Glenn Close, Alex Linz, Rosie O'Donnell, Brian Blessed",United States,26-Jun-20,1999,G,93 min,"Action-Adventure, Animation, Coming of Age","Adopted by gorillas, Tarzan’s life changes forever when he meets other humans."
s494,Movie,Tarzan II,Brian Smith,"Harrison Chad, George Carlin, Brad Garrett, Ron Perlman, Estelle Harris, Glenn Close",United States,26-Jun-20,2005,G,75 min,"Action-Adventure, Animation, Coming of Age",Young Tarzan decides his ape family would be better off without him.
s495,TV Show,101 Dalmatians (Series),,"Jeff Bennett, Christine Cavanaugh, Tara Charendoff, Jim Cummings, Tress MacNeille, Charlotte Rae",,19-Jun-20,1997,TV-Y7,1 Season,"Action-Adventure, Animation, Kids",The Dearly Family move to a new farm home in the country.
s496,Movie,Big Sur: Wild California,,Hector Elizondo,United States,19-Jun-20,2010,TV-PG,47 min,"Animals & Nature, Documentary, Family",Why is California's Big Sur coastline experiencing an explosion in wildlife?
s497,TV Show,Disney Junior Muppet Babies Play Date,,,,19-Jun-20,2018,TV-Y,1 Season,"Comedy, Kids",Time for a playdate with the Muppet Babies!
s498,Movie,Egypt's Treasure Guardians,"Ben Allen, Tom Jenner",Dominic Frisby,United Kingdom,19-Jun-20,2016,TV-PG,44 min,"Documentary, Historical","This programme follows a select cast of individuals, determined to bring Egypt back from the brink."
s499,Movie,The Jungle Book,Jon Favreau,"Bill Murray, Ben Kingsley, Idris Elba, Lupita Nyong'o, Scarlett Johansson, Giancarlo Esposito","United Kingdom, United States",19-Jun-20,2016,PG,108 min,"Action-Adventure, Coming of Age, Family",A man-cub who’s been raised by a family of wolves eludes a dangerous tiger.
s500,Movie,The Pirate Fairy,Peggy Holmes,"Mae Whitman, Christina Hendricks, Tom Hiddleston, Lucy Liu, Raven-Symoné , Megan Hilty",United States,19-Jun-20,2014,G,78 min,"Action-Adventure, Animation, Family",Tinker Bell and friends face the pirates of Skull Rock to save a friend.
s501,Movie,Trail Mix-Up,Barry Cook,"Charles Fleischer, Kathleen Turner, April Winchell, Lou Hirsch, Corey Burton, Frank Welker",United States,19-Jun-20,1993,TV-G,9 min,"Action-Adventure, Animation, Comedy",Roger Rabbit is left to care for Baby Herman in Yellowstone National Park.
s502,Movie,Tummy Trouble,"Frank Marshall, Rob Minkoff","Charles Fleischer, April Winchell, Lou Hirsch, Corey Burton, Richard Williams, Kathleen Turner",United States,19-Jun-20,1989,TV-G,8 min,"Action-Adventure, Animation, Comedy",Roger Rabbit is left to babysit with the mischievous Baby Herman
s503,Movie,Artemis Fowl,Kenneth Branagh,,United States,12-Jun-20,2020,PG,96 min,"Action-Adventure, Crime, Fantasy",A descendant of a long line of criminal masterminds seeks to find his father who has disappeared.
s504,TV Show,Mighty Med,,"Bradley Perry, Jake Short, Paris Berelc, Devan Leos",United States,12-Jun-20,2013,TV-Y7,2 Seasons,"Comedy, Coming of Age, Medical","Check in to Mighty Med, the secret superhero hospital."
s505,Movie,The Liberty Story,"Hamilton Luske, Robert Stevenson",Walt Disney,United States,12-Jun-20,1957,TV-PG,48 min,"Drama, Family, Historical",Walt Disney presents segments of America's fight for freedom. See details for advisory.
s506,Movie,The Story of the Animated Drawing,"Wilfred Jackson, William Beaudine",,United States,12-Jun-20,1955,TV-PG,49 min,"Documentary, Family",Walt Disney discusses the history of animation. See details for advisory.
s507,Movie,Walt & El Grupo,Theodore Thomas,,United States,12-Jun-20,2009,PG,108 min,"Documentary, Historical",The U.S. Government sends Walt Disney to South America on a goodwill tour.
s508,TV Show,Alaska's Grizzly Gauntlet,,Les Stroud,United States,5-Jun-20,2018,TV-PG,1 Season,"Animals & Nature, Docuseries, Family",Survival expert Les Stroud explores the world of Alaska’s most formidable wildlife.
s509,Movie,America's Greatest Animals,,"Bray Poor, Casey Anderson, Brady Barr, Andy Casagrande, Mireya Mayor",United States,5-Jun-20,2012,TV-PG,90 min,"Animals & Nature, Documentary, Family",Nat Geo WILD goes on a search for America's 'big five.' Can America compete with Africa's beasts?
s510,Movie,Chasing the Equinox,Kenny Scott,Stefan Frank,,5-Jun-20,2019,TV-PG,45 min,Documentary,Ancient civilizations shared an incredible knowledge of the sun.
s511,TV Show,Howie Mandel's Animals Doing Things,,Howie Mandel,United States,5-Jun-20,2017,TV-PG,2 Seasons,"Animals & Nature, Comedy, Family",This show combines Howie Mandel’s lovable comedic genius with clips of animals doing crazy things.
s512,TV Show,Japan: Between Earth and Sky,,Bray Poor,"France, Japan",5-Jun-20,2017,TV-PG,1 Season,"Animals & Nature, Docuseries",Japan: Between Earth and Sky reveals the mystery of some the most beautiful sites in the country.
s513,Movie,Percy Jackson & The Olympians: The Lightning Thief,Chris Columbus,"Logan Lerman, Brandon T. Jackson, Alexandra Daddario, Sean Bean, Pierce Brosnan, Steve Coogan","United Kingdom, Canada, United States",5-Jun-20,2010,PG,119 min,"Action-Adventure, Family, Fantasy",A boy discovers he's the descendant of Poseidon and must settle an on-going battle between the gods.
s514,TV Show,Secrets of Wild India,,David Attenborough,United Kingdom,5-Jun-20,2012,TV-PG,1 Season,"Animals & Nature, Docuseries, Family",'Secrets of Wild India' celebrates the diversity and drama of India's extraordinary landscapes.
s515,TV Show,The Greeks,,Toby Moore,United States,5-Jun-20,2016,TV-PG,1 Season,"Docuseries, Historical","Quite simply, the Greeks created our world."
s516,TV Show,Wild Hawaii,,JK Simmons,United States,5-Jun-20,2014,TV-PG,1 Season,"Animals & Nature, Docuseries, Family",National Geographic takes us on an untamed journey to Hawaii's remarkable lands.
s517,Movie,Women Of Impact: Changing The World,,Julianna Margulies,United States,5-Jun-20,2019,TV-PG,44 min,"Documentary, Historical",How will you make the world a better place? Hear stories of the amazing women changing our world.
s518,Movie,"Maggie Simpson in ""The Longest Daycare""",,,United States,29-May-20,2012,PG,5 min,"Animation, Comedy","In this Oscar-nominated short from The Simpsons, Maggie navigates an eventful first day at daycare."
s519,Movie,Mickey and the Seal,Charles Nichols,,United States,29-May-20,1948,TV-G,7 min,"Animation, Family",Mickey and Pluto get into trouble with a mischievous seal.
